[
  {
    "id": "FIND-12345678ABCD1234567890ABCDEF1234",
    "severity": "HIGH",
    "title": "Re-entrancy in withdraw function enables fund drainage through recursive calls",
    "category": "SWC-107-Reentrancy",
    "description": "The withdraw function performs an external call to transfer Ether before updating the user's balance, creating a classic reentrancy vulnerability. An attacker can deploy a malicious contract with a fallback function that recursively calls withdraw() during the external call execution, bypassing the balance check and potentially draining all contract funds. This vulnerability affects all Ethereum-compatible networks and poses a critical risk to user funds stored in the contract.",
    "confidence": "HIGH",
    "location": {
      "line": 125,
      "line_end": 129,
      "function": "withdraw",
      "contract": "VulnerableBank",
      "file": "contracts/VulnerableBank.sol",
      "code_snippet": "function withdraw(uint amount) public {\n    require(balances[msg.sender] >= amount);\n    msg.sender.call{value: amount}(\"\");\n    balances[msg.sender] -= amount;\n}",
      "affected_variables": ["balances", "amount"],
      "control_flow": {
        "entry_points": ["withdraw"],
        "execution_path": ["balance_check", "external_call", "state_update"],
        "conditions": ["User has sufficient balance", "External call succeeds"]
      }
    },
    "recommendation": {
      "immediate_action": "PATCH_IMMEDIATELY",
      "summary": "Implement checks-effects-interactions pattern with reentrancy guard to prevent recursive calls during external operations",
      "detailed_steps": [
        {
          "step": 1,
          "action": "Install OpenZeppelin's ReentrancyGuard contract",
          "code_example": "npm install @openzeppelin/contracts",
          "verification": "Check package.json for @openzeppelin/contracts dependency",
          "estimated_effort": "TRIVIAL"
        },
        {
          "step": 2,
          "action": "Import and inherit from ReentrancyGuard in vulnerable contract",
          "code_example": "import \"@openzeppelin/contracts/security/ReentrancyGuard.sol\";\ncontract VulnerableBank is ReentrancyGuard {",
          "verification": "Contract inherits from ReentrancyGuard",
          "estimated_effort": "EASY"
        },
        {
          "step": 3,
          "action": "Add nonReentrant modifier to withdraw function",
          "code_example": "function withdraw(uint amount) public nonReentrant {",
          "verification": "Function signature includes nonReentrant modifier",
          "estimated_effort": "EASY"
        },
        {
          "step": 4,
          "action": "Reorder operations to follow checks-effects-interactions pattern",
          "code_example": "function withdraw(uint amount) public nonReentrant {\n    require(balances[msg.sender] >= amount);\n    balances[msg.sender] -= amount; // Update state first\n    (bool success,) = msg.sender.call{value: amount}(\"\");\n    require(success, \"Transfer failed\");\n}",
          "verification": "State changes occur before external calls",
          "estimated_effort": "MODERATE"
        }
      ],
      "secure_pattern": {
        "name": "Checks-Effects-Interactions with ReentrancyGuard",
        "description": "Combination of state updates before external calls and mutex protection",
        "implementation": "function withdraw(uint amount) public nonReentrant {\n    require(balances[msg.sender] >= amount, \"Insufficient balance\");\n    balances[msg.sender] -= amount;\n    (bool success,) = msg.sender.call{value: amount}(\"\");\n    require(success, \"Transfer failed\");\n}",
        "references": [
          "https://docs.openzeppelin.com/contracts/4.x/api/security#ReentrancyGuard",
          "https://consensys.github.io/smart-contract-best-practices/attacks/reentrancy/"
        ]
      },
      "estimated_fix_time": "HOURS"
    },
    "risk_metrics": {
      "cvss_v3": {
        "score": 8.1,
        "vector": "CVSS:3.1/AV:N/AC:L/PR:L/UI:N/S:U/C:N/I:H/A:H"
      },
      "exploitability": {
        "ease": "EASY",
        "prerequisites": ["Deploy malicious contract", "Have sufficient balance to withdraw"],
        "attack_complexity": "LOW",
        "cost_to_exploit": "LOW"
      },
      "business_impact": {
        "financial": {
          "direct_loss": "HIGH",
          "loss_estimate": "All funds in contract could be drained within single transaction",
          "affected_funds": "USER_FUNDS"
        },
        "operational": "SEVERE",
        "reputation": "CRITICAL"
      }
    },
    "blockchain_context": {
      "networks": ["ETHEREUM", "POLYGON", "BSC", "ARBITRUM", "OPTIMISM"],
      "evm_specifics": {
        "solidity_version": "^0.8.0",
        "optimization_enabled": true,
        "optimization_runs": 200,
        "compiler_version": "0.8.19"
      },
      "gas_analysis": {
        "vulnerability_gas_cost": 21000,
        "fix_gas_impact": 2400,
        "optimization_potential": 0,
        "gas_limit_risk": false
      },
      "defi_context": {
        "protocol_type": ["LENDING"],
        "tvl_impact": "COMPLETE",
        "liquidity_risk": true,
        "oracle_dependency": false,
        "external_dependencies": []
      }
    },
    "ai_metadata": {
      "model": "gpt-4",
      "analysis_version": "5.0.0",
      "detection_method": "LLM_ANALYSIS",
      "prompt_engineering": {
        "prompt_version": "v5.0",
        "prompt_type": "COMPREHENSIVE",
        "context_window": 8192,
        "temperature": 0.1
      },
      "confidence_scoring": {
        "base_confidence": 0.95,
        "false_positive_probability": 0.02,
        "validation_score": 0.98,
        "contextual_factors": [
          {
            "factor": "Classic reentrancy pattern",
            "impact": 0.4,
            "weight": 0.4
          },
          {
            "factor": "External call before state change",
            "impact": 0.35,
            "weight": 0.35
          },
          {
            "factor": "Public function with balance manipulation",
            "impact": 0.25,
            "weight": 0.25
          }
        ]
      },
      "processing_info": {
        "analysis_time_ms": 1500,
        "tokens_used": 2048,
        "cost_usd": 0.045,
        "created_at": "2024-08-09T05:30:00Z"
      }
    },
    "attack_vector": {
      "description": "Deploy malicious contract with fallback function that calls withdraw recursively",
      "steps": [
        "Deploy malicious contract with fallback function",
        "Fund malicious contract with minimum withdrawal amount",
        "Call withdraw function from malicious contract",
        "Fallback function triggers during external call",
        "Recursive calls drain contract before balance update"
      ],
      "prerequisites": [
        "Ability to deploy contracts",
        "Minimum balance in target contract",
        "Understanding of Solidity execution order"
      ],
      "proof_of_concept": "contract MaliciousWithdrawer {\n    VulnerableBank public bank;\n    uint public amount;\n    \n    constructor(address _bank) {\n        bank = VulnerableBank(_bank);\n    }\n    \n    function attack(uint _amount) external {\n        amount = _amount;\n        bank.withdraw(_amount);\n    }\n    \n    fallback() external payable {\n        if (address(bank).balance >= amount) {\n            bank.withdraw(amount);\n        }\n    }\n}",
      "mitigation_bypasses": []
    },
    "related_findings": [],
    "compliance": {
      "standards": ["OWASP", "SWC", "CWE"],
      "regulatory_impact": ["Financial loss regulations", "Smart contract audit requirements"]
    },
    "quality_metrics": {
      "completeness_score": 98.5,
      "actionability_score": 95.0,
      "technical_depth_score": 92.0,
      "overall_quality_score": 95.2
    },
    "status": "OPEN",
    "tags": ["reentrancy", "fund-drainage", "critical-vulnerability", "defi-risk", "external-call"]
  },
  {
    "id": "FIND-87654321DCBA4567890FEDCBA9876543",
    "severity": "MEDIUM",
    "title": "Integer overflow in token calculation allows unlimited minting bypassing max supply check",
    "category": "SWC-101-Integer Overflow and Underflow",
    "description": "The mint function performs arithmetic operations on token amounts without proper overflow protection, allowing attackers to bypass maximum supply constraints through integer overflow exploitation. When a large value is passed to the mint function, the addition operation overflows and wraps around to a smaller value, circumventing the max supply check and enabling unlimited token creation.",
    "confidence": "MEDIUM",
    "location": {
      "line": 89,
      "line_end": 95,
      "function": "mint",
      "contract": "VulnerableToken",
      "file": "contracts/VulnerableToken.sol",
      "code_snippet": "function mint(address to, uint256 amount) public onlyOwner {\n    require(totalSupply + amount <= maxSupply, \"Exceeds max supply\");\n    totalSupply += amount;\n    balances[to] += amount;\n    emit Transfer(address(0), to, amount);\n}",
      "affected_variables": ["totalSupply", "maxSupply", "amount", "balances"],
      "control_flow": {
        "entry_points": ["mint"],
        "execution_path": ["supply_check", "supply_update", "balance_update"],
        "conditions": ["Caller is owner", "Supply check passes"]
      }
    },
    "recommendation": {
      "immediate_action": "PATCH_IMMEDIATELY",
      "summary": "Use SafeMath library or Solidity 0.8+ built-in overflow protection with proper validation",
      "detailed_steps": [
        {
          "step": 1,
          "action": "Upgrade to Solidity 0.8.0 or higher for built-in overflow protection",
          "code_example": "pragma solidity ^0.8.0;",
          "verification": "Contract compiles with Solidity 0.8+",
          "estimated_effort": "EASY"
        },
        {
          "step": 2,